                                                                       # URB length [bytes], Data length [bytes], Leftover Capture Data
  373  15.743047         host → 2.4.1        USB 72 URB_BULK out      # 8,8,80fa030000000000
  374  15.743121        2.4.1 → host         USB 64 URB_BULK out      # 8,0,
  375  15.743188         host → 2.4.1        USB 61504 URB_BULK out   # 260736,61440,800f0098fe0000000000000000000000000900009f010000
  376  15.743403         host → 2.4.1        USB 72 URB_BULK out      # 8,8,
  377  15.743424         host → 2.4.1        USB 80 URB_BULK out      # 16 ,16,80808080808080808080808000000000
  378  15.743441         host → 2.4.1        USB 72 URB_BULK out      # 8,8,00df3b0002000000
  379  15.743833         host → 2.4.1        USB 61504 URB_BULK out   # 1048576,61440,000000000000000000000000000000000000000000000000
  380  15.744073        2.4.1 → host         USB 64 URB_BULK out      # 260736,0,
  381  15.744577        2.4.1 → host         USB 64 URB_BULK out      # 8,0,
  382  15.744585        2.4.1 → host         USB 64 URB_BULK out      # 16,0,
  383  15.744593        2.4.1 → host         USB 64 URB_BULK out      # 8,0,
  384  15.745013         host → 2.4.1        USB 61504 URB_BULK out   # 1048576,61440,e71e61a841678c1e9970758290c5feab135795f48742cf41
  385  15.746098         host → 2.4.1        USB 61504 URB_BULK out   # 1048576,61440,29968bdfac700de091b106f582f0563f38c58fd73819bc26
  386  15.802554        2.4.1 → host         USB 64 URB_BULK out      # 1048576,0,
  387  15.802940         host → 2.4.1        USB 61504 URB_BULK out   # 777984,61440,c504abe33d36d2d74c4d280a9e0a3b4c7d61c91205cd328a
  388  15.819983        2.4.1 → host         USB 64 URB_BULK out      # 1048576,0,
  389  15.820096         host → 2.4.1        USB 72 URB_BULK out      # 8,8,2000040000000000
  390  15.820216         host → 2.4.1        USB 61504 URB_BULK out   # 262176,61440,800f000000010000000000000000000080f6ff1f8a000000
  391  15.837408        2.4.1 → host         USB 64 URB_BULK out      # 1048576,0,
  392  15.837501         host → 2.4.1        USB 72 URB_BULK out      # 8,8,00b7600002000000
  393  15.837888         host → 2.4.1        USB 61504 URB_BULK out   # 1048576,61440,000000000000000000000000000000000000000000000000
  394  15.850631        2.4.1 → host         USB 64 URB_BULK out      # 777984,0,
  395  15.850650        2.4.1 → host         USB 64 URB_BULK out      # 8,0,
  396  15.851107         host → 2.4.1        USB 61504 URB_BULK out   # 1048576,61440,d1ada8fe1935ece81f307f777899bfb24066590ada29cd32
  397  15.851249        2.4.1 → host         USB 64 URB_BULK out      # 262176,0,
  398  15.851840        2.4.1 → host         USB 64 URB_BULK out      # 8,0,
  399  15.852279         host → 2.4.1        USB 61504 URB_BULK out   # 1048576,61440,63c67b4b1f817556884b265ace3c9573ae76ddeb4a4d07a1
  400  15.867370        2.4.1 → host         USB 64 URB_BULK out      # 1048576,0,
  401  15.867835         host → 2.4.1        USB 61504 URB_BULK out   # 1048576,61440,037e551b6b3f5c775fa236268b0b7484228be68fb17a50fb
  402  15.884789        2.4.1 → host         USB 64 URB_BULK out      # 1048576,0,
  403  15.885261         host → 2.4.1        USB 61504 URB_BULK out   # 1048576,61440,da5e29713109729592e6e63077cd9331090a0b0ffc9b6eab
  404  15.902221        2.4.1 → host         USB 64 URB_BULK out      # 1048576,0,
  405  15.902730         host → 2.4.1        USB 61504 URB_BULK out   # 1048576,61440,787bc5b3f1f8f62851da861e0613c9edf5d490f19c5ef049
  406  15.919641        2.4.1 → host         USB 64 URB_BULK out      # 1048576,0,
  407  15.919761         host → 2.4.1        USB 46912 URB_BULK out   # 46848,46848,0f56e7ca12953cb45b0a1eecde77f9fcbdeac055f25dbd2f
  408  15.937085        2.4.1 → host         USB 64 URB_BULK out      # 1048576,0,
  409  15.937180         host → 2.4.1        USB 72 URB_BULK out      # 8,8,9060010000000000
  410  15.937233         host → 2.4.1        USB 61504 URB_BULK out   # 90256,61440,800f001c58000000000000000000000080f6ff1f08010000
  411  15.954509        2.4.1 → host         USB 64 URB_BULK out      # 1048576,0,
  412  15.954610         host → 2.4.1        USB 72 URB_BULK out      # 8,8,
  413  15.955003         host → 2.4.1        USB 61504 URB_BULK out   # 1048576,61440,000000000000000000000000000000000000000000000000
  414  15.955306        2.4.1 → host         USB 64 URB_BULK out      # 46848,0,
  415  15.955732        2.4.1 → host         USB 64 URB_BULK out      # 8,0,
  416  15.955742        2.4.1 → host         USB 64 URB_BULK out      # 90256,0,
  417  15.955750        2.4.1 → host         USB 64 URB_BULK out      # 8,0,
  418  15.956194         host → 2.4.1        USB 61504 URB_BULK out   # 1048576,61440,81f27bdddafc74131fbb7da073a0e09f33a7a41f3e07f586
  419  15.956948         host → 2.4.1        USB 61504 URB_BULK out   # 65920,61440,b87351d2f862e5abf7f340e2ceabe792e2669637905952e6
  420  15.972055        2.4.1 → host         USB 64 URB_BULK out      # 1048576,0,
  421  15.989481        2.4.1 → host         USB 64 URB_BULK out      # 1048576,0,
  422  15.991049        2.4.1 → host         USB 64 URB_BULK out      # 65920,0,
  423  15.991865        2.4.1 → host         USB 72 URB_BULK in       # 8,8,0000000000000000
  424  15.991881        2.4.2 → host         USB 80 URB_BULK in       # 16,16,00000000000000000000000004000000
  425  15.991936         host → 2.4.2        USB 64 URB_BULK in       # 16,0,
  426  15.991958         host → 2.4.1        USB 64 URB_BULK in       # 1024,0,
  